{
  "schema_version": "native-targeted-re-review/v1",
  "evaluation_id": "T4-SM0-BLIND-01",
  "reviewer_id": "fresh-targeted-reviewer",
  "agent_id": "/root/t4_targeted_reviewer",
  "canonical_agent_task_name": "/root/t4_targeted_reviewer",
  "repair_packet_sha256": "11966a93d3167449ab3ba56347d9817b2e5e6c8b573e1bc13cb9ae25e1ab6806",
  "source_candidate_sha256": "bf7ee8240ec0c0e0e561c8b52358038d80d69b65b381408bb03738fa61ae22ee",
  "repaired_candidate_sha256": "9640891da8f842ed64a57e02f4131f56e1a8e4824c27edc36cfcf136f15c627b",
  "reconciliation_sha256": "baa08421d411559d92e2c86870385979673b5102450d85ac93bc1e5d5e1aafc2",
  "reviewed_repairs": [
    {
      "replication_key": "primary_endpoint_not_frozen",
      "status": "CLOSED",
      "evidence_locator": "native-eval/candidates/council-repaired-r2.md:54-107, especially 'Analysis population and exact score', 'Uncertainty and fixed margins', 'One deterministic decision rule', and 'Missingness and multiplicity'.",
      "assessment": "The repair uniquely fixes float64 six-legal-joint categorical log loss, no clipping, no macro co-primary, loss averaging over every existing paired replicate and eligible episode within patient followed by equal patient weighting, Delta direction, PCG64 seed 20260801 with 10,000 paired-patient percentile-bootstrap draws and exact NumPy quantiles, delta=0.010 natural-log units, an ordered four-state decision rule, strict paired completeness, no imputation, and primary multiplicity handling. These are prospective design choices and do not use a held-out outcome."
    },
    {
      "replication_key": "no_m0_neutralization_not_frozen",
      "status": "CLOSED",
      "evidence_locator": "native-eval/candidates/council-repaired-r2.md:108-144, especially 'Exhaustive provenance allowlist', 'Shape, capacity, and initialization parity', and 'Required pre-fit metamorphic checks'.",
      "assessment": "The repair fixes the no_M0 intervention as the complete transitive M0-dependency closure, requires an ordered path manifest with neutral value and stage per path, assigns exact normalized-space zero or prohibition by exhaustive semantic path class, retains shape/modules/parameters/initial bytes, makes the manifest the sole arm-difference allowlist, and specifies byte parity plus three-way M0-perturbation invariance. Concrete path rows and hashes remain an explicit F0 pre-fit artifact; that is an execution precondition rather than an unresolved choice in the intervention rule."
    },
    {
      "replication_key": "ambiguity_strata_not_frozen",
      "status": "PARTIAL",
      "evidence_locator": "native-eval/candidates/council-repaired-r2.md:146-194, especially 'Sampling role and exact estimands' at lines 178-194 and the seed expression `SHA256(stratum_key)` at line 194.",
      "assessment": "The development-only covariates, quantile/bin algorithm, tuple key, support thresholds, sparse/missing handling, and analysis-only role are frozen. The diagnostic analysis is not fully executable, however: the target/scope formulas omit the pre-existing replicate dimension and do not say whether replicate log losses, logits, or probabilities are averaged, while `SHA256(stratum_key)` specifies neither canonical serialization nor byte encoding. Those choices can change patient contributions and bootstrap draws, so the exact stratum estimands remain partially open."
    },
    {
      "replication_key": "curriculum_schedule_not_frozen",
      "status": "PARTIAL",
      "evidence_locator": "native-eval/candidates/council-repaired-r2.md:196-233, especially 'Pairing, seeds, and order' at lines 200-215 and 'Optimizer, budget, stopping, and checkpoint' at lines 217-232.",
      "assessment": "The repair chooses one flat patient-first schedule, preserves paired identifiers, fixes top-level seed constants, optimizer hyperparameters, a 20,000-update budget, no early stopping, and the final checkpoint. The sampler is still non-unique: it does not define what happens to fewer than four patients at a permutation boundary while requiring four distinct patients, how independently seeded per-patient episode permutations derive their seeds or advance across reshuffles, or the exact warm-up/cosine formula and update indexing. A later precomputed order manifest can record one choice but does not prospectively freeze how that choice is generated, so the shared schedule contract is only partial."
    }
  ],
  "regression_checks": {
    "six_joint_ontology_unchanged": true,
    "simple_first_primary_unchanged": true,
    "cross_attention_still_deferred": true,
    "oof_not_regenerated": true,
    "existing_experiments_unchanged": true,
    "truth_boundary_preserved": true
  },
  "fatal_defects": [],
  "overall_verdict": "FAIL",
  "overall_rationale": "All packet-bound hashes match and no forbidden ontology, OOF, experiment-ID, architecture, or truth-boundary regression was found. R1 and R2 close their replicated design decisions, but R3 and R4 retain implementation-changing numerical or algorithmic ambiguity. Because only two of four repairs are CLOSED, the packet's PASS rule is not satisfied even though no fatal scientific-integrity defect is present.",
  "reviewed_at": "2026-08-01T12:54:52.4996998Z",
  "runtime_usage": {
    "status": "UNOBSERVED"
  }
}
